[
  {
    "misconceptionId": "MISC.LINEQ.STOPS_BEFORE_DIVIDING",
    "domain": "linear-equations",
    "title": "Stops before dividing by the coefficient",
    "description": "The student isolates the variable term but reports that term as the variable, without dividing by its coefficient.",
    "observableError": "Isolated the variable term but did not divide by its coefficient.",
    "typicalIncorrectMethod": "From (p - r)x = t - q, writes x = t - q instead of x = (t - q)/(p - r).",
    "distractorRule": { "summary": "Use t - q instead of (t - q)/(p - r)", "expression": "t - q" },
    "validRange": { "levels": ["middle-school"] },
    "feedback": "You have isolated the variable term, but not the variable. Divide both sides by the coefficient of x.",
    "reviewStatus": "proposed",
    "version": "1.0.0"
  },
  {
    "misconceptionId": "MISC.LINEQ.WRONG_INVERSE",
    "domain": "linear-equations",
    "title": "Wrong inverse operation on the constant",
    "description": "The student adds the constant instead of subtracting it (or vice versa) when moving it across the equals sign.",
    "observableError": "Used the wrong inverse operation on the constant term.",
    "typicalIncorrectMethod": "Adds q to the other side instead of subtracting it.",
    "distractorRule": { "summary": "Use (t + q)/(p - r)", "expression": "(t + q)/(p - r)" },
    "validRange": { "levels": ["middle-school"] },
    "feedback": "Use the inverse operation on the constant term and apply it to both sides.",
    "reviewStatus": "proposed",
    "version": "1.0.0"
  },
  {
    "misconceptionId": "MISC.LINEQ.VAR_SIGN",
    "domain": "linear-equations",
    "title": "Wrong sign moving a variable term",
    "description": "The student moves the variable term to the other side without flipping its sign.",
    "observableError": "Moved the variable term to the other side without flipping its sign.",
    "typicalIncorrectMethod": "Treats the new variable coefficient as p + r instead of p - r.",
    "distractorRule": { "summary": "Use (t - q)/(p + r)", "expression": "(t - q)/(p + r)" },
    "validRange": { "levels": ["middle-school"] },
    "feedback": "Move the variable term to the other side by applying the opposite operation to both sides.",
    "reviewStatus": "proposed",
    "version": "1.0.0"
  },
  {
    "misconceptionId": "MISC.LINEQ.CONST_SIGN",
    "domain": "linear-equations",
    "title": "Wrong sign moving a constant",
    "description": "The student changes the sign of a constant without applying the operation to both sides.",
    "observableError": "Changed the sign of a constant without applying the operation to both sides.",
    "typicalIncorrectMethod": "Computes (q - t)/(p - r) instead of (t - q)/(p - r).",
    "distractorRule": { "summary": "Use (q - t)/(p - r)", "expression": "(q - t)/(p - r)" },
    "validRange": { "levels": ["middle-school"] },
    "feedback": "Apply the same subtraction to both sides and check the order of the constants.",
    "reviewStatus": "proposed",
    "version": "1.0.0"
  },
  {
    "misconceptionId": "MISC.LINEQ.COMBINE_UNLIKE_AS_COEFFICIENT",
    "domain": "linear-equations",
    "title": "Combines unlike terms",
    "description": "The student adds an x-term and a constant into a single coefficient of x.",
    "observableError": "Combined an x-term and a constant into a single coefficient.",
    "typicalIncorrectMethod": "Treats px + q as (p + q)x, then solves t = (p + q - r)x.",
    "distractorRule": { "summary": "Use t/(p + q - r)", "expression": "t/(p + q - r)" },
    "validRange": { "levels": ["middle-school"] },
    "feedback": "An x-term and a constant are unlike terms. Their coefficients cannot be combined.",
    "reviewStatus": "proposed",
    "version": "1.0.0"
  },
  {
    "misconceptionId": "MISC.LINEQ.DIVIDE_ONE_TERM",
    "domain": "linear-equations",
    "title": "Divides only one term",
    "description": "The student divides one term on the side by the coefficient but not every term.",
    "observableError": "Divided only one term on the side, not every term.",
    "typicalIncorrectMethod": "From (p - r)x + q = t, writes x = t/(p - r) - q (divides t but not q).",
    "distractorRule": { "summary": "Use t/(p - r) - q", "expression": "t/(p - r) - q" },
    "validRange": { "levels": ["middle-school"] },
    "feedback": "When dividing an equation, divide every term on the relevant side by the coefficient.",
    "reviewStatus": "proposed",
    "version": "1.0.0"
  },
  {
    "misconceptionId": "MISC.LINEQ.DIVIDE_BY_CONSTANT",
    "domain": "linear-equations",
    "title": "Divides by the constant",
    "description": "The student divides by the constant term instead of by the coefficient of x.",
    "observableError": "Divided by the constant term instead of the coefficient of x.",
    "typicalIncorrectMethod": "Computes (t - q)/q instead of (t - q)/(p - r).",
    "distractorRule": { "summary": "Use (t - q)/q", "expression": "(t - q)/q" },
    "validRange": { "levels": ["middle-school"] },
    "feedback": "Divide by the coefficient of x, not by the constant term.",
    "reviewStatus": "proposed",
    "version": "1.0.0"
  },
  {
    "misconceptionId": "MISC.LINEQ.IGNORE_CONSTANT",
    "domain": "linear-equations",
    "title": "Ignores the constant",
    "description": "The student reads off the right-hand value as the answer, ignoring the added or subtracted constant.",
    "observableError": "Ignored the added or subtracted constant.",
    "typicalIncorrectMethod": "For x + q = t, writes x = t.",
    "distractorRule": { "summary": "Use t (ignoring q)", "expression": "t" },
    "validRange": { "levels": ["middle-school"] },
    "feedback": "Apply the inverse of the constant to both sides; do not ignore it.",
    "reviewStatus": "proposed",
    "version": "1.0.0"
  },
  {
    "misconceptionId": "MISC.LINEQ.MULTIPLY_INSTEAD_OF_DIVIDE",
    "domain": "linear-equations",
    "title": "Multiplies instead of dividing",
    "description": "The student multiplies both sides by the coefficient instead of dividing by it.",
    "observableError": "Multiplied by the coefficient instead of dividing by it.",
    "typicalIncorrectMethod": "For px = t, writes x = p*t.",
    "distractorRule": { "summary": "Use p*t", "expression": "p * t" },
    "validRange": { "levels": ["middle-school"] },
    "feedback": "To undo multiplication by the coefficient, divide both sides by it.",
    "reviewStatus": "proposed",
    "version": "1.0.0"
  },
  {
    "misconceptionId": "MISC.LINEQ.REVERSES_DIVISION",
    "domain": "linear-equations",
    "title": "Reverses the division",
    "description": "The student divides the coefficient by the constant instead of the constant by the coefficient.",
    "observableError": "Inverted the division: used p/t instead of t/p.",
    "typicalIncorrectMethod": "For px = t, writes x = p/t.",
    "distractorRule": { "summary": "Use p/t", "expression": "p / t" },
    "validRange": { "levels": ["middle-school"] },
    "feedback": "Divide the constant by the coefficient, not the coefficient by the constant.",
    "reviewStatus": "proposed",
    "version": "1.0.0"
  },
  {
    "misconceptionId": "MISC.LINEQ.DISTRIBUTE_PARTIAL",
    "domain": "linear-equations",
    "title": "Partial distribution over brackets",
    "description": "The student multiplies the factor outside the bracket by the variable term only, not the constant term.",
    "observableError": "Multiplied only the first term inside the brackets by the factor.",
    "typicalIncorrectMethod": "Expands k(px + q) as kp*x + q (constant not multiplied), then solves.",
    "distractorRule": { "summary": "Expand k(px + q) -> kp*x + q", "expression": "(t - q)/(p - r)" },
    "validRange": { "levels": ["middle-school"] },
    "feedback": "Multiply every term inside the brackets by the factor outside.",
    "reviewStatus": "proposed",
    "version": "1.0.0"
  },
  {
    "misconceptionId": "MISC.LINEQ.SIGNED_ARITH_SLIP",
    "domain": "linear-equations",
    "title": "Signed-number arithmetic slip",
    "description": "A generic signed-number arithmetic error. Used only as a diagnostic category for free-response analysis; it is not a deterministic multiple-choice distractor rule.",
    "observableError": "Made a signed-number arithmetic error.",
    "typicalIncorrectMethod": "Sign or arithmetic error during an otherwise valid step.",
    "validRange": { "levels": ["middle-school"] },
    "feedback": "Re-check the signed arithmetic at each step.",
    "reviewStatus": "proposed",
    "version": "1.0.0"
  }
]
