[
  {
    "misconceptionId": "MISC.SEQ.OFFBYONE_TERMINDEX",
    "domain": "sequences-and-series",
    "objectiveRelationships": ["SPI.IBDPAASL.SEQSER.ARITH.NTH_TERM.01"],
    "title": "Off-by-one in term index",
    "description": "Uses n steps of the common difference instead of (n - 1).",
    "observableError": "Answer is exactly one common difference too large.",
    "typicalIncorrectMethod": "Computes u_1 + n*d instead of u_1 + (n-1)*d.",
    "distractorRule": { "summary": "Use n steps instead of (n-1)", "expression": "u_1 + n*d" },
    "validRange": { "levels": ["middle-school", "high-school", "ibdp-aasl"] },
    "feedback": "Reaching the nth term takes (n - 1) steps of the common difference, not n.",
    "reviewStatus": "approved",
    "version": "1.0.0"
  },
  {
    "misconceptionId": "MISC.SEQ.SIGN_DIFFERENCE",
    "domain": "sequences-and-series",
    "objectiveRelationships": ["SPI.IBDPAASL.SEQSER.ARITH.NTH_TERM.01"],
    "title": "Sign error on the common difference",
    "description": "Subtracts the common difference instead of adding it.",
    "observableError": "Answer reflects the wrong direction of change.",
    "typicalIncorrectMethod": "Computes u_1 - (n-1)*d instead of u_1 + (n-1)*d.",
    "distractorRule": { "summary": "Subtract instead of add", "expression": "u_1 - (n-1)*d" },
    "validRange": { "levels": ["middle-school", "high-school", "ibdp-aasl"] },
    "feedback": "Add the common difference (which may be negative); check whether the sequence increases or decreases.",
    "reviewStatus": "approved",
    "version": "1.0.0"
  },
  {
    "misconceptionId": "MISC.SEQ.FORGOT_MULTIPLY",
    "domain": "sequences-and-series",
    "objectiveRelationships": ["SPI.IBDPAASL.SEQSER.ARITH.NTH_TERM.01"],
    "title": "Forgot to multiply by the common difference",
    "description": "Adds the number of steps but omits multiplying by d.",
    "observableError": "Answer adds (n - 1) rather than (n - 1)*d.",
    "typicalIncorrectMethod": "Computes u_1 + (n-1) instead of u_1 + (n-1)*d.",
    "distractorRule": { "summary": "Add (n-1) without multiplying by d", "expression": "u_1 + (n-1)" },
    "validRange": { "levels": ["middle-school", "high-school", "ibdp-aasl"] },
    "feedback": "Each step changes the term by d, so multiply the (n - 1) steps by the common difference.",
    "reviewStatus": "approved",
    "version": "1.0.0"
  },
  {
    "misconceptionId": "MISC.SEQ.FORGOT_FIRST_TERM",
    "domain": "sequences-and-series",
    "objectiveRelationships": ["SPI.IBDPAASL.SEQSER.ARITH.NTH_TERM.01"],
    "title": "Omitted the first term",
    "description": "Computes (n - 1)*d but forgets to add the first term u_1.",
    "observableError": "Answer is the change from u_1, not the term value itself.",
    "typicalIncorrectMethod": "Computes (n-1)*d and stops, omitting u_1.",
    "distractorRule": { "summary": "Compute (n-1)*d without adding u_1", "expression": "(n-1)*d" },
    "validRange": { "levels": ["middle-school", "high-school", "ibdp-aasl"] },
    "feedback": "Add the first term u_1 to (n - 1)*d to get the nth term.",
    "reviewStatus": "approved",
    "version": "1.0.0"
  },
  {
    "misconceptionId": "MISC.SERIES.FORGOT_HALF",
    "domain": "sequences-and-series",
    "objectiveRelationships": ["SPI.IBDPAASL.SEQSER.ARITH.SUM_N.01"],
    "title": "Omitted the one-half in the sum formula",
    "description": "Uses n*(2u_1 + (n-1)d) without dividing by 2.",
    "observableError": "Sum is exactly twice the correct value.",
    "typicalIncorrectMethod": "Computes n*(2*u_1 + (n-1)*d) with no division by 2.",
    "distractorRule": { "summary": "Drop the factor of one half", "expression": "n*(2*u_1 + (n-1)*d)" },
    "validRange": { "levels": ["high-school", "ibdp-aasl"] },
    "feedback": "The sum formula has a factor of one half: S_n = (n/2)(2u_1 + (n - 1)d).",
    "reviewStatus": "approved",
    "version": "1.0.0"
  },
  {
    "misconceptionId": "MISC.SERIES.CONSTANT_LAST_TERM",
    "domain": "sequences-and-series",
    "objectiveRelationships": ["SPI.IBDPAASL.SEQSER.ARITH.SUM_N.01"],
    "title": "Treats every term as equal to the last term",
    "description": "Multiplies the number of terms by the last (nth) term.",
    "observableError": "Sum equals n multiplied by the nth term.",
    "typicalIncorrectMethod": "Computes n * u_n.",
    "distractorRule": { "summary": "Multiply the number of terms by the last term", "expression": "n*u_n" },
    "validRange": { "levels": ["high-school", "ibdp-aasl"] },
    "feedback": "The terms change by the common difference; do not multiply the number of terms by only the last term.",
    "reviewStatus": "approved",
    "version": "1.0.0"
  },
  {
    "misconceptionId": "MISC.SERIES.CONSTANT_FIRST_TERM",
    "domain": "sequences-and-series",
    "objectiveRelationships": ["SPI.IBDPAASL.SEQSER.ARITH.SUM_N.01"],
    "title": "Treats every term as equal to the first term",
    "description": "Multiplies the number of terms by the first term.",
    "observableError": "Sum equals n multiplied by the first term.",
    "typicalIncorrectMethod": "Computes n * u_1.",
    "distractorRule": { "summary": "Multiply the number of terms by the first term", "expression": "n*u_1" },
    "validRange": { "levels": ["high-school", "ibdp-aasl"] },
    "feedback": "The terms change by the common difference. Do not multiply the number of terms by only the first term.",
    "reviewStatus": "approved",
    "version": "1.0.0"
  }
]
